{
  "schemaVersion": "1.0",
  "sourceCommit": "ca207c477c5a9d5aedc484131528db8849b7abc6",
  "sourceUrl": "https://github.com/jitawangzi/agent-sop.git",
  "toolPolicy": {
    "path": "config/hook-tool-policy.json",
    "blobSha256": "4f7d65637992d73eafc277c82153c4f6bee27a4375d5fe185308da9768f7eee5"
  },
  "certification": {
    "path": "distribution/harness-certification.json",
    "blobSha256": "41c9114e1f2e32e67505aff16c4365d4357dc6c0b75e95615b45080669d7be4a"
  },
  "projections": [
    {
      "source": "distribution/templates/root/CLAUDE.md",
      "target": "CLAUDE.md",
      "sourceBlobSha256": "20305dfa8014985dc84755abfcbc27651961b05fd8821766c90db8aae36a01d3",
      "targetSha256": "20305dfa8014985dc84755abfcbc27651961b05fd8821766c90db8aae36a01d3",
      "legacySha256": "92bebe5c475de01e480311abe623ab55a714066267decdda906789d3bf86d1f5",
      "encoding": "utf8-no-bom",
      "lineEnding": "lf"
    },
    {
      "source": "distribution/templates/root/AGENTS.md",
      "target": "AGENTS.md",
      "sourceBlobSha256": "b09a10805a8cbf2d35859e9144578f321f5b092c537c65092a00602ea096f9a3",
      "targetSha256": "b09a10805a8cbf2d35859e9144578f321f5b092c537c65092a00602ea096f9a3",
      "legacySha256": "25903e4b86512c55ac3f7e7aee50f1c7ab4557e276cd9322619c731a180574dc",
      "encoding": "utf8-no-bom",
      "lineEnding": "lf"
    },
    {
      "source": "distribution/templates/root/ANTIGRAVITY.md",
      "target": "ANTIGRAVITY.md",
      "sourceBlobSha256": "a89dfd65ad1ebed11e54aa27fbcd495da9448f35ff0d9e49c6b8ba4bca2044ec",
      "targetSha256": "a89dfd65ad1ebed11e54aa27fbcd495da9448f35ff0d9e49c6b8ba4bca2044ec",
      "legacySha256": "48e29a97bf70a1690f3c20a91eb4c2f1bad8d20a340abfaa92e2e76f9e469e25",
      "encoding": "utf8-no-bom",
      "lineEnding": "lf"
    },
    {
      "source": "distribution/templates/root/GEMINI.md",
      "target": "GEMINI.md",
      "sourceBlobSha256": "9135d12802638eb7d8bc9639dd44ca76482189264d368c8be989b1395296beb2",
      "targetSha256": "9135d12802638eb7d8bc9639dd44ca76482189264d368c8be989b1395296beb2",
      "legacySha256": "9135d12802638eb7d8bc9639dd44ca76482189264d368c8be989b1395296beb2",
      "encoding": "utf8-no-bom",
      "lineEnding": "lf"
    },
    {
      "source": "distribution/templates/root/ai-sop.ps1",
      "target": "ai-sop.ps1",
      "sourceBlobSha256": "ba48105718e9fca79452ea769a5bdccb03ffb361a53f43a11f67c265deaf5e96",
      "targetSha256": "ba48105718e9fca79452ea769a5bdccb03ffb361a53f43a11f67c265deaf5e96",
      "legacySha256": "559596303d23f80e2a6b8e10d8473e2825720f2decb389f58e1d5c658c4d9534",
      "encoding": "utf8-no-bom",
      "lineEnding": "lf"
    },
    {
      "source": "distribution/templates/tools/install-ai-sop.ps1",
      "target": "tools/ai-sop/install-ai-sop.ps1",
      "sourceBlobSha256": "902d646972734dfbc0e6a30f15ca604dc88131c9ed710a83e1d3feab6e7cd9d1",
      "targetSha256": "902d646972734dfbc0e6a30f15ca604dc88131c9ed710a83e1d3feab6e7cd9d1",
      "legacySha256": "",
      "encoding": "utf8-no-bom",
      "lineEnding": "lf"
    },
    {
      "source": "distribution/templates/hooks/agents-hooks.json",
      "target": ".agents/hooks.json",
      "sourceBlobSha256": "2ffb56609ca9160a5c6f803999b103fc6de6f9004004581088542a8e0c0e4061",
      "targetSha256": "2ffb56609ca9160a5c6f803999b103fc6de6f9004004581088542a8e0c0e4061",
      "legacySha256": "f2711d5f1809917cb57640f07a589e9f538ffd767eea316f6303c294913ae0b9",
      "encoding": "utf8-no-bom",
      "lineEnding": "lf"
    },
    {
      "source": "distribution/templates/hooks/cursor-hooks.json",
      "target": ".cursor/hooks.json",
      "sourceBlobSha256": "61d5faef77a9be12b04c57ad185e5563740a604229c6960bb1e76368ea4abe4f",
      "targetSha256": "61d5faef77a9be12b04c57ad185e5563740a604229c6960bb1e76368ea4abe4f",
      "legacySha256": "",
      "encoding": "utf8-no-bom",
      "lineEnding": "lf"
    },
    {
      "source": "distribution/templates/hooks/copilot-hooks.json",
      "target": ".github/hooks/ai-sop.json",
      "sourceBlobSha256": "8740ad69c6ee9ac06147b8021908a52d978646f94decb9ca2d9e919c006adbae",
      "targetSha256": "8740ad69c6ee9ac06147b8021908a52d978646f94decb9ca2d9e919c006adbae",
      "legacySha256": "",
      "encoding": "utf8-no-bom",
      "lineEnding": "lf"
    },
    {
      "source": "distribution/templates/hooks/hook-wrapper.ps1",
      "target": ".agents/hook-wrapper.ps1",
      "sourceBlobSha256": "12d9fb7fce11e224e6cd76dd366d638ff3aa586f9a141f20c08aabbda9557e9e",
      "targetSha256": "12d9fb7fce11e224e6cd76dd366d638ff3aa586f9a141f20c08aabbda9557e9e",
      "legacySha256": "",
      "encoding": "utf8-no-bom",
      "lineEnding": "lf"
    },
    {
      "source": "distribution/templates/hooks/hook-wrapper.ps1",
      "target": ".claude/hook-wrapper.ps1",
      "sourceBlobSha256": "12d9fb7fce11e224e6cd76dd366d638ff3aa586f9a141f20c08aabbda9557e9e",
      "targetSha256": "12d9fb7fce11e224e6cd76dd366d638ff3aa586f9a141f20c08aabbda9557e9e",
      "legacySha256": "",
      "encoding": "utf8-no-bom",
      "lineEnding": "lf"
    },
    {
      "source": "distribution/templates/hooks/hook-wrapper.ps1",
      "target": ".cursor/hook-wrapper.ps1",
      "sourceBlobSha256": "12d9fb7fce11e224e6cd76dd366d638ff3aa586f9a141f20c08aabbda9557e9e",
      "targetSha256": "12d9fb7fce11e224e6cd76dd366d638ff3aa586f9a141f20c08aabbda9557e9e",
      "legacySha256": "",
      "encoding": "utf8-no-bom",
      "lineEnding": "lf"
    },
    {
      "source": "distribution/templates/hooks/hook-wrapper.ps1",
      "target": ".github/hook-wrapper.ps1",
      "sourceBlobSha256": "12d9fb7fce11e224e6cd76dd366d638ff3aa586f9a141f20c08aabbda9557e9e",
      "targetSha256": "12d9fb7fce11e224e6cd76dd366d638ff3aa586f9a141f20c08aabbda9557e9e",
      "legacySha256": "",
      "encoding": "utf8-no-bom",
      "lineEnding": "lf"
    },
    {
      "source": "distribution/templates/hooks/claude-settings.json",
      "target": ".claude/settings.json",
      "sourceBlobSha256": "58c28b0c307927e34b92f660e57e858b9be8f5dafed8e829262b91196f6e1874",
      "targetSha256": "58c28b0c307927e34b92f660e57e858b9be8f5dafed8e829262b91196f6e1874",
      "legacySha256": "",
      "encoding": "utf8-no-bom",
      "lineEnding": "lf",
      "verifyMode": "json-hooks-merge"
    }
  ]
}
